{
  "schema_version": 1,
  "generated_at": "2026-08-16T00:00:00Z",
  "source_commit": "0123456789abcdef",
  "repo": {
    "id": "example-repo",
    "full_name": "owner/example-repo",
    "url": "https://github.com/owner/example-repo",
    "default_branch": "main",
    "description": "Example only"
  },
  "stats": {"tools": 1, "cases": 0},
  "tools": [{"id": "example-tool", "name": "Example Tool", "path": "tools/example.py"}],
  "toolsets": [],
  "cases": [],
  "opportunities": [],
  "intelligence": [],
  "sources": [],
  "activity": []
}
